{
  "claims": {
    "dyadic": true,
    "float_exact": true
  },
  "curve": {
    "coeffs": [
      "0"
    ],
    "curve_id": "FL-1-h5-g10-e1o2-curve",
    "domain": [
      "0",
      "100"
    ],
    "family": "polynomial"
  },
  "family": "FL-1",
  "initial_state": [
    {
      "ball_id": 0,
      "pos": {
        "x": "0",
        "y": "5"
      },
      "radius": "0.1",
      "restitution": "1/2",
      "vel": {
        "vx": "1",
        "vy": "0"
      }
    }
  ],
  "physics": {
    "gravity": "10"
  },
  "provenance_tier": 1,
  "reference_events": [
    {
      "ball_id": 0,
      "contact": {
        "x": "1",
        "y": "0"
      },
      "seq": 0,
      "t": "1",
      "tier": 1
    },
    {
      "ball_id": 0,
      "contact": {
        "x": "2",
        "y": "0"
      },
      "seq": 1,
      "t": "2",
      "tier": 1
    },
    {
      "ball_id": 0,
      "contact": {
        "x": "5/2",
        "y": "0"
      },
      "seq": 2,
      "t": "5/2",
      "tier": 1
    },
    {
      "ball_id": 0,
      "contact": {
        "x": "11/4",
        "y": "0"
      },
      "seq": 3,
      "t": "11/4",
      "tier": 1
    },
    {
      "ball_id": 0,
      "contact": {
        "x": "23/8",
        "y": "0"
      },
      "seq": 4,
      "t": "23/8",
      "tier": 1
    },
    {
      "ball_id": 0,
      "contact": {
        "x": "47/16",
        "y": "0"
      },
      "seq": 5,
      "t": "47/16",
      "tier": 1
    },
    {
      "ball_id": 0,
      "contact": {
        "x": "95/32",
        "y": "0"
      },
      "seq": 6,
      "t": "95/32",
      "tier": 1
    },
    {
      "ball_id": 0,
      "contact": {
        "x": "191/64",
        "y": "0"
      },
      "seq": 7,
      "t": "191/64",
      "tier": 1
    }
  ],
  "scenario_id": "FL-1-h5-g10-e1o2",
  "schema_version": "1",
  "verification": {
    "method": "exact-rational",
    "residual_max": "0"
  }
}
