{
  "claims": {
    "hand_authored_assessment": true
  },
  "curve": {
    "coeffs": [
      "0",
      "0",
      "-1/20",
      "0",
      "1/400"
    ],
    "curve_id": "twowell-poly4-curve",
    "domain": [
      "-35",
      "35"
    ],
    "family": "polynomial"
  },
  "family": "ASSESS-A2",
  "initial_state": [
    {
      "ball_id": 0,
      "pos": {
        "x": "4",
        "y": "3/5"
      },
      "radius": "0.1",
      "restitution": "1/2",
      "vel": {
        "vx": "2/3",
        "vy": "0"
      }
    }
  ],
  "physics": {
    "gravity": "11"
  },
  "provenance_tier": 2,
  "reference_events": [],
  "scenario_id": "twowell-poly4",
  "schema_version": "1",
  "verification": {
    "method": "none-assessment-only",
    "residual_max": "0"
  }
}
